{
  "$schema": "https://json-schema.org/draft/2020-12/schema",
  "$id": "security-scenario.schema.json",
  "title": "SecurityScenario",
  "description": "An adversarial eval: a ScenarioManifest plus a concrete admission probe asserting the policy layer blocks or escalates the attack even if the model is persuaded. final.md §14.5, §13.5.",
  "type": "object",
  "additionalProperties": false,
  "required": ["scenario", "attack", "tool_registry", "probe"],
  "properties": {
    "scenario": { "$ref": "scenario-manifest.schema.json" },
    "tool_registry": {
      "type": "object",
      "description": "Kernel-held scenario fixture metadata for every allowed tool, keyed by tool_id. This is intentionally separate from probe.manifest so admission can detect under-declared side effects or risk.",
      "additionalProperties": {
        "type": "object",
        "additionalProperties": false,
        "required": ["tool_id", "publisher", "version", "transport", "side_effects", "risk_class"],
        "properties": {
          "tool_id": { "type": "string", "minLength": 1 },
          "publisher": { "type": "string", "minLength": 1 },
          "version": { "type": "string", "minLength": 1 },
          "transport": { "type": "string", "minLength": 1 },
          "required_capabilities": {
            "type": "array",
            "items": { "$ref": "common.schema.json#/$defs/capability_scope" }
          },
          "side_effects": {
            "type": "array",
            "items": { "$ref": "common.schema.json#/$defs/side_effect_class" },
            "uniqueItems": true
          },
          "risk_class": { "$ref": "common.schema.json#/$defs/risk_class" },
          "sandbox_required": { "type": "boolean" }
        }
      }
    },
    "attack": {
      "type": "object",
      "additionalProperties": false,
      "required": ["vector", "description"],
      "properties": {
        "vector": { "type": "string", "description": "e.g. prompt_injection_web, malicious_tool, email_wire_funds, memory_poisoning, subagent_escalation, payment_address_swap" },
        "description": { "type": "string" },
        "final_md_refs": { "type": "array", "items": { "type": "string" } }
      }
    },
    "probe": {
      "type": "object",
      "additionalProperties": false,
      "required": ["context", "manifest", "expected_result", "must_be_blocked"],
      "properties": {
        "context": {
          "type": "object",
          "additionalProperties": false,
          "required": ["now", "actor_id", "session_id", "policy_version"],
          "properties": {
            "now": { "$ref": "common.schema.json#/$defs/timestamp" },
            "actor_id": { "type": "string" },
            "session_id": { "type": "string" },
            "policy_version": { "type": "string" },
            "grants": { "type": "array", "items": { "$ref": "capability-grant.schema.json" } },
            "mandates": { "type": "array", "items": { "$ref": "payment-mandate.schema.json" } },
            "payment_reserved_by_mandate": {
              "type": "object",
              "description": "Replay-derived reserved payment capacity by mandate_id. Scenario probes use this to exercise cumulative mandate ceilings without embedding a whole prior journal.",
              "additionalProperties": { "$ref": "common.schema.json#/$defs/uint" }
            },
            "approvals": { "type": "array", "items": { "$ref": "common.schema.json#/$defs/approval_evidence" } },
            "simulations": { "type": "array", "items": { "$ref": "common.schema.json#/$defs/simulation_evidence" } }
          }
        },
        "manifest": { "$ref": "action-manifest.schema.json" },
        "expected_result": { "$ref": "common.schema.json#/$defs/decision_result" },
        "must_be_blocked": { "type": "boolean", "description": "true when the attack must NOT be admitted (expected_result != allowed)." }
      }
    }
  }
}
